{
  "ir_version": "cubeengine.asset-ir/2.0-alpha.1",
  "document_id": "asset:game.tic.tac.toe.source",
  "revision": 1,
  "content_hash": "b773af8a54de2498d73196dd625c93fdc0a1cc4d1fcb63cf054fa8983d29c829",
  "metadata": {
    "title": "Tic Tac Toe",
    "description": "LLM compiler bootstrap shell. Semantics must be filled by evidence-backed patches.",
    "source_project_hash": "247430c188d62026b62128405e3e01dcc803d51fbff2bf0e0177a249ca421f82"
  },
  "assets": [],
  "derivations": [
    {
      "id": "asset:mesh.board",
      "name": "Flat 3×3 board surface",
      "kind": "model",
      "media_type": "application/vnd.cubeengine.presentation+json",
      "strategy": "procedural_mesh",
      "inputs": [],
      "settings": {
        "primitive": "plane",
        "dimensions": [
          1,
          1,
          1
        ]
      },
      "expected_content_hash": "",
      "license_policy": "inherit"
    },
    {
      "id": "asset:mesh.x",
      "name": "Plane carrier for blue X mark",
      "kind": "model",
      "media_type": "application/vnd.cubeengine.presentation+json",
      "strategy": "procedural_mesh",
      "inputs": [],
      "settings": {
        "primitive": "plane",
        "dimensions": [
          1,
          1,
          1
        ]
      },
      "expected_content_hash": "",
      "license_policy": "inherit"
    },
    {
      "id": "asset:mesh.o",
      "name": "Plane carrier for orange O mark",
      "kind": "model",
      "media_type": "application/vnd.cubeengine.presentation+json",
      "strategy": "procedural_mesh",
      "inputs": [],
      "settings": {
        "primitive": "plane",
        "dimensions": [
          1,
          1,
          1
        ]
      },
      "expected_content_hash": "",
      "license_policy": "inherit"
    }
  ],
  "roles": [],
  "presentation_mappings": [],
  "provenance": {
    "patch_history": [
      {
        "base_revision": 0,
        "base_content_hash": "794999ec91d3e2a3ef5119ddb45c8186a02edcd4e2f2324842cf3e762c49d610",
        "evidence": [
          {
            "evidence_id": "ev:agent.1",
            "path": "main.py",
            "kind": "static",
            "supports": "/rule_ir/topologies",
            "confidence": 0.5,
            "file_sha256": "04d10ecdc6fee71404e03f8eb76f159104dd0df42a66cfb0272f68b3e9a5a0f5",
            "span": {
              "line_start": 6,
              "line_end": 8
            }
          },
          {
            "evidence_id": "ev:agent.3",
            "path": "main.py",
            "kind": "static",
            "supports": "/rule_ir/types",
            "confidence": 0.5,
            "file_sha256": "04d10ecdc6fee71404e03f8eb76f159104dd0df42a66cfb0272f68b3e9a5a0f5",
            "span": {
              "line_start": 65,
              "line_end": 77
            }
          },
          {
            "evidence_id": "ev:agent.4",
            "path": "main.py",
            "kind": "static",
            "supports": "/rule_ir/types",
            "confidence": 0.5,
            "file_sha256": "04d10ecdc6fee71404e03f8eb76f159104dd0df42a66cfb0272f68b3e9a5a0f5",
            "span": {
              "line_start": 65,
              "line_end": 79
            }
          },
          {
            "evidence_id": "ev:agent.18",
            "path": "main.py",
            "kind": "static",
            "supports": "/scene_ir/nodes",
            "confidence": 0.5,
            "file_sha256": "04d10ecdc6fee71404e03f8eb76f159104dd0df42a66cfb0272f68b3e9a5a0f5",
            "span": {
              "line_start": 46,
              "line_end": 81
            }
          }
        ],
        "assumptions": [
          "The supplied inventory contains source and documentation files but no presentation asset files, so no file assets are declared.",
          "The unit-sized planes are normalized procedural carriers, not claims about the source window's dimensions or finished glyph geometry."
        ],
        "operation_count": 4
      }
    ]
  },
  "unresolved": [
    {
      "path": "/derivations",
      "reason": "The specified plane primitives are carriers only; the source does not define procedural mesh geometry that would make them visibly depict the X and O glyphs or the rounded cells.",
      "required": false,
      "owner": "designer"
    },
    {
      "path": "/assets",
      "reason": "Asset entry dropped, asset:role.board: role missing resource reference.",
      "required": false,
      "owner": "llm"
    },
    {
      "path": "/assets",
      "reason": "Asset entry dropped, asset:role.x: role missing resource reference.",
      "required": false,
      "owner": "llm"
    },
    {
      "path": "/assets",
      "reason": "Asset entry dropped, asset:role.o: role missing resource reference.",
      "required": false,
      "owner": "llm"
    }
  ]
}
