{
  "ir_version": "cubeengine.asset-ir/2.0-alpha.1",
  "document_id": "asset:game.snake.game.with.python.and.pygame.source",
  "revision": 1,
  "content_hash": "e82d4fe32d8bca6248f3dc99a8c121a88ee2907160baba2f7dba7878cbd0a5c7",
  "metadata": {
    "title": "Snake Game with Python and Pygame",
    "description": "LLM compiler bootstrap shell. Semantics must be filled by evidence-backed patches.",
    "source_project_hash": "5e6c01f21edd4537d785e7258b03bb92cb90549bd37e58594257f836a2d92d58"
  },
  "assets": [
    {
      "id": "asset:image.apple",
      "name": "Apple Texture",
      "kind": "image",
      "source": {
        "uri": "project://Graphics/apple.png",
        "content_hash": "9fef533da2d37741de43e78bec068f87752fcfde21e782daf5eb7b7ebe968ade",
        "byte_size": 632
      },
      "media_type": "image/png",
      "license": {
        "spdx_id": "NOASSERTION",
        "attribution": "",
        "source_uri": null,
        "redistribution": "unknown"
      },
      "importer": {
        "capability": "cubeengine.image",
        "version": "1.0",
        "settings": {}
      },
      "metadata": {}
    },
    {
      "id": "asset:font.poetsen.one",
      "name": "PoetsenOne Font",
      "kind": "font",
      "source": {
        "uri": "project://Font/PoetsenOne-Regular.ttf",
        "content_hash": "85b9c540b6e59c75c3eea602d9256ec5eb386f49c982d86ced4b7c161aac2a2f",
        "byte_size": 172456
      },
      "media_type": "font/ttf",
      "license": {
        "spdx_id": "NOASSERTION",
        "attribution": "",
        "source_uri": null,
        "redistribution": "unknown"
      },
      "importer": {
        "capability": "cubeengine.raw-file",
        "version": "1.0",
        "settings": {}
      },
      "metadata": {}
    }
  ],
  "derivations": [],
  "roles": [],
  "presentation_mappings": [],
  "provenance": {
    "patch_history": [
      {
        "base_revision": 0,
        "base_content_hash": "b948dc61b637af87d764687cd4540e2175bded0dc4e1605eb4c9b46a84785d0e",
        "evidence": [
          {
            "evidence_id": "ev:asset.font_poetsenone_regular_ttf",
            "path": "Font/PoetsenOne-Regular.ttf",
            "kind": "static",
            "supports": "/asset_ir/assets",
            "confidence": 0.7,
            "file_sha256": "85b9c540b6e59c75c3eea602d9256ec5eb386f49c982d86ced4b7c161aac2a2f",
            "span": {
              "byte_start": 0,
              "byte_end": 64
            }
          }
        ],
        "assumptions": [],
        "operation_count": 3
      }
    ]
  },
  "unresolved": [
    {
      "path": "/assets",
      "reason": "Asset entry dropped, asset:role.food.texture: role missing resource reference.",
      "required": false,
      "owner": "llm"
    }
  ]
}
