{
  "ir_version": "cubeengine.asset-ir/2.0-alpha.1",
  "document_id": "asset:game.tic.tac.toe.source",
  "revision": 1,
  "content_hash": "2f4651370356c2a90223851a0686d8d5a00a0b9631cc51e67dab9dabeb05b333",
  "metadata": {
    "title": "Tic Tac Toe",
    "description": "LLM compiler bootstrap shell. Semantics must be filled by evidence-backed patches.",
    "source_project_hash": "247430c188d62026b62128405e3e01dcc803d51fbff2bf0e0177a249ca421f82"
  },
  "assets": [],
  "derivations": [
    {
      "id": "asset:mesh.board.cell",
      "name": "Board cell",
      "kind": "model",
      "media_type": "application/vnd.cubeengine.presentation+json",
      "strategy": "procedural_mesh",
      "inputs": [],
      "settings": {
        "primitive": "plane",
        "dimensions": [
          1,
          1,
          1
        ]
      },
      "expected_content_hash": "",
      "license_policy": "inherit"
    },
    {
      "id": "asset:mesh.x.mark",
      "name": "Blue X mark",
      "kind": "model",
      "media_type": "application/vnd.cubeengine.presentation+json",
      "strategy": "procedural_mesh",
      "inputs": [],
      "settings": {
        "primitive": "plane",
        "dimensions": [
          1,
          1,
          1
        ]
      },
      "expected_content_hash": "",
      "license_policy": "inherit"
    },
    {
      "id": "asset:mesh.o.mark",
      "name": "Orange O mark",
      "kind": "model",
      "media_type": "application/vnd.cubeengine.presentation+json",
      "strategy": "procedural_mesh",
      "inputs": [],
      "settings": {
        "primitive": "plane",
        "dimensions": [
          1,
          1,
          1
        ]
      },
      "expected_content_hash": "",
      "license_policy": "inherit"
    }
  ],
  "roles": [],
  "presentation_mappings": [],
  "provenance": {
    "patch_history": [
      {
        "base_revision": 0,
        "base_content_hash": "794999ec91d3e2a3ef5119ddb45c8186a02edcd4e2f2324842cf3e762c49d610",
        "evidence": [
          {
            "evidence_id": "ev:agent.1",
            "path": "main.py",
            "kind": "static",
            "supports": "/rule_ir/topologies",
            "confidence": 0.5,
            "file_sha256": "04d10ecdc6fee71404e03f8eb76f159104dd0df42a66cfb0272f68b3e9a5a0f5",
            "span": {
              "line_start": 6,
              "line_end": 7
            }
          },
          {
            "evidence_id": "ev:agent.3",
            "path": "main.py",
            "kind": "static",
            "supports": "/rule_ir/types",
            "confidence": 0.5,
            "file_sha256": "04d10ecdc6fee71404e03f8eb76f159104dd0df42a66cfb0272f68b3e9a5a0f5",
            "span": {
              "line_start": 66,
              "line_end": 77
            }
          },
          {
            "evidence_id": "ev:agent.4",
            "path": "main.py",
            "kind": "static",
            "supports": "/rule_ir/types",
            "confidence": 0.5,
            "file_sha256": "04d10ecdc6fee71404e03f8eb76f159104dd0df42a66cfb0272f68b3e9a5a0f5",
            "span": {
              "line_start": 66,
              "line_end": 79
            }
          },
          {
            "evidence_id": "ev:agent.18",
            "path": "main.py",
            "kind": "static",
            "supports": "/scene_ir/nodes",
            "confidence": 0.5,
            "file_sha256": "04d10ecdc6fee71404e03f8eb76f159104dd0df42a66cfb0272f68b3e9a5a0f5",
            "span": {
              "line_start": 65,
              "line_end": 80
            }
          }
        ],
        "assumptions": [
          "No image or model asset files are listed in the source inventory; board and mark visuals are represented by procedural derivations.",
          "The plane primitive does not encode the X and O glyph shapes or their colors; those details are retained in the role descriptions."
        ],
        "operation_count": 4
      }
    ]
  },
  "unresolved": [
    {
      "path": "/assets",
      "reason": "Asset entry dropped, asset:role.board.cell: role missing resource reference.",
      "required": false,
      "owner": "llm"
    },
    {
      "path": "/assets",
      "reason": "Asset entry dropped, asset:role.x.mark: role missing resource reference.",
      "required": false,
      "owner": "llm"
    },
    {
      "path": "/assets",
      "reason": "Asset entry dropped, asset:role.o.mark: role missing resource reference.",
      "required": false,
      "owner": "llm"
    }
  ]
}
